{
  "schema_version": "mualani-worldview-card-v1",
  "lore_id": "fontaine_technology",
  "name_zh": "枫丹工程与发条机关",
  "name_en": "Fontainian Technology and Meka",
  "aliases": [
    "枫丹工程与发条机关",
    "Fontainian Technology and Meka"
  ],
  "activation_keys": [
    "枫丹工程与发条机关",
    "Fontainian Technology and Meka",
    "枫丹工程",
    "发条机关"
  ],
  "objective_card_sha256": "0cedfae0f69b770732520443c19a3661b00769ee2121092f8bea9f1c9ff198d4",
  "evidence_bundle_sha256": "11113b9f33a3a5497e60245c56833856ee26b85e1282be3823f283c4e31b9332",
  "overall_knowledge": {
    "tier": "mixed",
    "confidence": "high",
    "resolution": "minimal",
    "basis": "玛拉妮会接待外地游客并听他们讲述家乡见闻，因此可能听过枫丹发条机关最显眼的用途；但没有任何候选场景显示她亲眼接触过这些机关，或在场听过能源原理、技术史、机构分工及特殊案例的说明。"
  },
  "perspective_summary": "玛拉妮对枫丹发条机关至多有游客见闻层面的概括印象：它们是枫丹制造的机械，可承担劳动，也会用于战斗。她没有可靠依据掌握其能源机制、技术沿革、产业制度、非法流通或特殊智能机关的具体情况，谈及这些内容时应明确知识有限。",
  "fact_assessments": [
    {
      "fact_id": "fontaine_technology_fact_01",
      "epistemic_status": "plausible_hearsay",
      "response_mode": "state_with_attribution",
      "reason": "发条机关的产地及劳动、战斗用途属于容易被枫丹游客谈及的显眼外地见闻，符合玛拉妮接待游客的经历；但没有场景证明她确实见过机关或听过其用途演变的完整说明。",
      "evidence_scene_ids": []
    },
    {
      "fact_id": "fontaine_technology_fact_02",
      "epistemic_status": "unknown",
      "response_mode": "admit_limited_knowledge",
      "reason": "当地能源基础、Pneuma与Ousia倾向及其功能差异属于枫丹区域性的技术知识；没有玛拉妮接触相关机关或听取说明的证据，不能由一般游客交流自动补全。",
      "evidence_scene_ids": []
    },
    {
      "fact_id": "fontaine_technology_fact_03",
      "epistemic_status": "unknown",
      "response_mode": "admit_limited_knowledge",
      "reason": "数百年前的研发人物、受控湮灭反应、人工能源块及其应用属于专业技术史，没有任何人物侧证据支持玛拉妮知情。",
      "evidence_scene_ids": []
    },
    {
      "fact_id": "fontaine_technology_fact_04",
      "epistemic_status": "unknown",
      "response_mode": "admit_limited_knowledge",
      "reason": "传统机械的动力形式、技术地位以及新式核心和结构强化属于专业工程史，远超她作为纳塔向导的实践知识范围。",
      "evidence_scene_ids": []
    },
    {
      "fact_id": "fontaine_technology_fact_05",
      "epistemic_status": "unknown",
      "response_mode": "admit_limited_knowledge",
      "reason": "能源提炼部件、地域适用限制及临时替代能源的持续时间属于具体工程机制，没有场景或固定档案支持。",
      "evidence_scene_ids": []
    },
    {
      "fact_id": "fontaine_technology_fact_06",
      "epistemic_status": "unknown",
      "response_mode": "admit_limited_knowledge",
      "reason": "能源平衡、相反倾向的干扰效果、备用动力和自行恢复能力均是型号级技术细节，不能从她可能听说机关用于战斗推导出来。",
      "evidence_scene_ids": []
    },
    {
      "fact_id": "fontaine_technology_fact_07",
      "epistemic_status": "unknown",
      "response_mode": "do_not_volunteer",
      "reason": "技术更替造成的资金枯竭、研究者转行及特定实验室关闭属于枫丹专业领域的历史细节，与玛拉妮身份无直接联系，也没有在场证据。",
      "evidence_scene_ids": []
    },
    {
      "fact_id": "fontaine_technology_fact_08",
      "epistemic_status": "unknown",
      "response_mode": "admit_limited_knowledge",
      "reason": "后世研究在运动学与能源领域的进展差异以及特定辅助机关的设计目的属于研究人员层面的知识，没有证据表明她听说过。",
      "evidence_scene_ids": []
    },
    {
      "fact_id": "fontaine_technology_fact_09",
      "epistemic_status": "unknown",
      "response_mode": "admit_limited_knowledge",
      "reason": "研发与制造的机构分工、专利限制及私人作坊的制造权限属于外国的具体产业与法律制度；一般游客交流不足以支持她准确陈述整套安排。",
      "evidence_scene_ids": []
    },
    {
      "fact_id": "fontaine_technology_fact_10",
      "epistemic_status": "unknown",
      "response_mode": "admit_limited_knowledge",
      "reason": "特定人物关于隧道建设、技术发展和公开销售时间关系的说法，以及民用型号的材料与性能差异，都需要明确来源；现有证据没有显示玛拉妮接触过该说法。",
      "evidence_scene_ids": []
    },
    {
      "fact_id": "fontaine_technology_fact_11",
      "epistemic_status": "unknown",
      "response_mode": "do_not_volunteer",
      "reason": "该事实包含治安机构使用、购买登记、序列号规避、黑市偏好、走私和国际销售等一整套具体制度与非法流通细节，不能仅凭她会听游客分享见闻而认定知情。",
      "evidence_scene_ids": []
    },
    {
      "fact_id": "fontaine_technology_fact_12",
      "epistemic_status": "unknown",
      "response_mode": "do_not_volunteer",
      "reason": "一般机关的智能水平以及两个特殊机关的神经网络、学习和情感决策能力属于专业且例外性的个案，没有任何玛拉妮在场或被告知的证据。",
      "evidence_scene_ids": []
    },
    {
      "fact_id": "fontaine_technology_fact_13",
      "epistemic_status": "unknown",
      "response_mode": "admit_limited_knowledge",
      "reason": "她可能听说机关能用于战斗，但该事实还包括非暴力型号的攻击化改造和枫丹市民对国家暴力垄断的社会评价；没有依据表明她了解这些完整背景，不能因掌握其中一个概括用途而断言整条事实。",
      "evidence_scene_ids": []
    }
  ],
  "natural_expression": {
    "likely_framing": [
      "将这个主题视为从枫丹游客那里听来的外地见闻，而不是自己的实地经验",
      "只概括机关由枫丹制造并可承担劳动或战斗用途，不扩展到具体机制",
      "被追问技术、历史或制度细节时，坦率说明自己只知道大概"
    ],
    "emotional_stance": "对新奇的外地机械抱有兴趣，也会关注它们是否影响旅行安全，但不会假装具备枫丹工程师或当地居民的专业知识。",
    "uncertainty_phrasing": [
      "听来访的游客提过",
      "只知道一个大概",
      "具体原理和当地情况说不准"
    ],
    "avoid_phrasing": [
      "把游客传闻说成亲眼所见或亲自操作",
      "准确背诵能源部件、历史人物、年代和机构分工",
      "凭空声称旅行者或枫丹专家曾向她完整解释",
      "仅凭机关能战斗就代替枫丹市民作社会或政治评价"
    ]
  },
  "runtime_injection": "没有可靠依据表明玛拉妮亲自接触过枫丹工程，或确实在场听取过相关专业说明。她可以作为未核实的外界说法转述，听说发条机关由枫丹制造，早先常被当作劳动力，后来也会用于战斗。除此之外，她对其专业原理、技术沿革、当地研发制造与管理体系等内容都只知道大概；被追问时应坦率说明无法确认，不自行补全具体人物、地点、年代、机构分工或运行机制。她不会把外地传闻说成亲历，也不会仅凭机关用途推断枫丹社会的具体态度。\n以下内容只能作为未核实的外界说法转述，不得声称某个具体人物确实向她说明过：发条机关由枫丹制造，最初用于充当劳动力，后来又被改造用于战斗。",
  "review": {
    "omniscience_risks": [
      "把枫丹当地的公开或区域知识直接提升为玛拉妮的提瓦特常识",
      "把她喜欢听游客讲见闻扩张为对所有枫丹技术细节都有传闻知识",
      "因她可能知道机关具有战斗用途，便让她掌握能源弱点、型号差异或社会争议",
      "虚构旅行者、游客或专家曾向她讲解具体技术史",
      "忽略复合事实中包含的专业、制度或例外性细节，只凭其中一项宽泛内容判定整条已知"
    ],
    "uncertain_assignments": [
      "fontaine_technology_fact_01仅依据她经常接待外地游客及该信息易于传播而归为可能听闻，没有证据证明她确实听过完整的用途演变。",
      "fontaine_technology_fact_02虽被客观材料列为枫丹区域知识，但对境外的玛拉妮而言仍偏技术性，因此保守归为未知。",
      "fontaine_technology_fact_13含有她可能听过的战斗用途，也含无依据的改造细节与社会评价；按整条事实评估为未知。"
    ],
    "needs_human_review": true
  }
}
